{
  "schema_version": "kyuubiki.language-pack/v1",
  "id": "hub-zh-tw-core-2.0",
  "language": "zh-TW",
  "targetSurface": "hub",
  "name": "Traditional Chinese Hub Core",
  "version": "3.7.0",
  "versionLine": "daji 3.x",
  "targetAppVersion": "3.7.0",
  "source": "downloaded",
  "updatedAt": "2026-09-19T00:00:00.000Z",
  "description": "Traditional Chinese UI translations for Hub navigation, shell actions, and primary route labels.",
  "overrides": {
    "nav": {
      "projects": "首頁",
      "runtimes": "執行環境",
      "deploy": "部署",
      "observe": "觀察",
      "tools": "工具"
    },
    "sections": {
      "projects": {
        "title": "首頁",
        "copy": "開啟 Workbench、驗證環境，然後依照清楚流程啟動本機堆疊。"
      },
      "runtimes": {
        "title": "執行環境",
        "copy": "啟動本機堆疊，並讓操作人員清楚看見動作狀態。"
      },
      "deploy": {
        "title": "部署",
        "copy": "部署前先驗證工作站路徑、發行根目錄與 runtime 就緒狀態。"
      }
    },
    "shell": {
      "language": "繁體中文",
      "actionStatus": "動作狀態",
      "idle": "閒置",
      "openWorkbench": "開啟 Workbench",
      "startLocal": "啟動本機堆疊",
      "validateEnv": "驗證環境"
    },
    "bundles": {
      "introTitle": "專案套件",
      "introCopy": "檢查、比較並準備專案套件，接著進行分析。",
      "bundlePath": "套件路徑",
      "comparePath": "比較路徑",
      "outputPath": "輸出路徑",
      "inspect": "檢查套件",
      "validate": "驗證套件",
      "normalize": "正規化套件",
      "unpack": "解開套件",
      "pack": "封裝專案",
      "diff": "比較套件",
      "openWorkbench": "開啟工作台",
      "desktopTools": "桌面工具",
      "recentBundles": "最近的套件",
      "recentCompare": "最近的比較路徑",
      "recentOutputs": "最近的輸出",
      "recentActions": "最近的套件操作",
      "favorites": "收藏",
      "ready": "專案套件工具已就緒。",
      "all": "全部",
      "failed": "失敗",
      "keepFailed": "僅保留失敗項目",
      "import": "匯入 JSON",
      "export": "匯出 JSON",
      "clear": "清除歷史",
      "recent": "最近",
      "introLabel": "專案套件"
    },
    "home": {
      "tabs": {
        "bundles": "專案套件"
      }
    }
  }
}
