{
  "schema_version": "kyuubiki.language-pack/v1",
  "id": "hub-nl-core-2.0",
  "language": "nl",
  "targetSurface": "hub",
  "name": "Dutch Hub Core",
  "version": "3.7.1",
  "versionLine": "daji 3.x",
  "targetAppVersion": "3.7.1",
  "source": "downloaded",
  "updatedAt": "2026-09-19T00:00:00.000Z",
  "description": "Dutch UI translations for Hub navigation, shell actions, and primary route labels.",
  "overrides": {
    "nav": {
      "projects": "Home",
      "runtimes": "Runtimes",
      "deploy": "Uitrollen",
      "observe": "Observeren",
      "tools": "Hulpmiddelen"
    },
    "sections": {
      "projects": {
        "title": "Home",
        "copy": "Open Workbench, valideer de omgeving en start de lokale stack in een heldere flow."
      },
      "runtimes": {
        "title": "Runtimes",
        "copy": "Start de lokale stack en houd de actiestatus zichtbaar voor operators."
      },
      "deploy": {
        "title": "Uitrollen",
        "copy": "Valideer vóór uitrol stationpaden, release-roots en runtime-gereedheid."
      }
    },
    "shell": {
      "language": "Nederlands",
      "actionStatus": "Actiestatus",
      "idle": "inactief",
      "openWorkbench": "Workbench openen",
      "startLocal": "Lokale stack starten",
      "validateEnv": "Omgeving valideren"
    },
    "bundles": {
      "introTitle": "Projectpakketten",
      "introCopy": "Controleer, vergelijk en bereid projectpakketten voor analyse voor.",
      "bundlePath": "Pakketpad",
      "comparePath": "Vergelijkingspad",
      "outputPath": "Uitvoerpad",
      "inspect": "Pakket inspecteren",
      "validate": "Pakket valideren",
      "normalize": "Pakket normaliseren",
      "unpack": "Pakket uitpakken",
      "pack": "Project inpakken",
      "diff": "Pakketten vergelijken",
      "openWorkbench": "Workbench openen",
      "desktopTools": "Bureaubladgereedschap",
      "recentBundles": "Recente pakketten",
      "recentCompare": "Recente vergelijkingen",
      "recentOutputs": "Recente uitvoer",
      "recentActions": "Recente pakketacties",
      "favorites": "Favorieten",
      "ready": "De pakketgereedschappen zijn klaar.",
      "all": "Alle",
      "failed": "Mislukt",
      "keepFailed": "Alleen fouten bewaren",
      "import": "JSON importeren",
      "export": "JSON exporteren",
      "clear": "Geschiedenis wissen",
      "recent": "Recent",
      "introLabel": "Projectpakketten"
    },
    "home": {
      "tabs": {
        "bundles": "Projectpakketten"
      }
    }
  }
}
