{
  "schema_version": "kyuubiki.language-pack/v1",
  "id": "hub-he-core-2.0",
  "language": "he",
  "targetSurface": "hub",
  "name": "Hebrew Hub Core",
  "version": "3.7.1",
  "versionLine": "daji 3.x",
  "targetAppVersion": "3.7.1",
  "source": "downloaded",
  "updatedAt": "2026-09-19T00:00:00.000Z",
  "description": "Hebrew UI translations for Hub navigation, shell actions, and primary route labels.",
  "overrides": {
    "nav": {
      "projects": "בית",
      "runtimes": "סביבות ריצה",
      "deploy": "פריסה",
      "observe": "תצפית",
      "tools": "כלים"
    },
    "sections": {
      "projects": {
        "title": "בית",
        "copy": "פתח את Workbench, אמת את הסביבה והפעל את המחסנית המקומית במסלול ברור."
      },
      "runtimes": {
        "title": "סביבות ריצה",
        "copy": "הפעל את המחסנית המקומית ושמור את מצב הפעולה גלוי למפעילים."
      },
      "deploy": {
        "title": "פריסה",
        "copy": "לפני פריסה, אמת נתיבי תחנה, שורשי גרסה ומוכנות סביבת ריצה."
      }
    },
    "shell": {
      "language": "עברית",
      "actionStatus": "מצב פעולה",
      "idle": "לא פעיל",
      "openWorkbench": "פתח Workbench",
      "startLocal": "הפעל מחסנית מקומית",
      "validateEnv": "אמת סביבה"
    },
    "bundles": {
      "introTitle": "חבילות פרויקט",
      "introCopy": "בדיקה, השוואה והכנת חבילות פרויקט לניתוח.",
      "bundlePath": "נתיב החבילה",
      "comparePath": "נתיב להשוואה",
      "outputPath": "נתיב הפלט",
      "inspect": "בדיקת החבילה",
      "validate": "אימות החבילה",
      "normalize": "נרמול החבילה",
      "unpack": "חילוץ החבילה",
      "pack": "אריזת הפרויקט",
      "diff": "השוואת חבילות",
      "openWorkbench": "פתיחת Workbench",
      "desktopTools": "כלי שולחן עבודה",
      "recentBundles": "חבילות אחרונות",
      "recentCompare": "השוואות אחרונות",
      "recentOutputs": "פלטים אחרונים",
      "recentActions": "פעולות אחרונות בחבילות",
      "favorites": "מועדפים",
      "ready": "כלי החבילות מוכנים.",
      "all": "הכול",
      "failed": "נכשלו",
      "keepFailed": "השארת כישלונות בלבד",
      "import": "ייבוא JSON",
      "export": "ייצוא JSON",
      "clear": "ניקוי ההיסטוריה",
      "recent": "אחרונים",
      "introLabel": "חבילות פרויקט"
    },
    "home": {
      "tabs": {
        "bundles": "חבילות פרויקט"
      }
    }
  }
}
