{
  "schema_version": "kyuubiki.language-pack/v1",
  "id": "hub-hi-core-2.0",
  "language": "hi",
  "targetSurface": "hub",
  "name": "Hindi Hub Core",
  "version": "3.7.1",
  "versionLine": "daji 3.x",
  "targetAppVersion": "3.7.1",
  "source": "downloaded",
  "updatedAt": "2026-09-19T00:00:00.000Z",
  "description": "Hindi UI translations for Hub navigation, shell actions, and primary route labels.",
  "overrides": {
    "nav": {
      "projects": "होम",
      "runtimes": "रनटाइम",
      "deploy": "तैनात करें",
      "observe": "निरीक्षण",
      "tools": "उपकरण"
    },
    "sections": {
      "projects": {
        "title": "होम",
        "copy": "Workbench खोलें, पर्यावरण सत्यापित करें, फिर स्पष्ट प्रवाह में स्थानीय स्टैक शुरू करें।"
      },
      "runtimes": {
        "title": "रनटाइम",
        "copy": "स्थानीय स्टैक शुरू करें और क्रिया स्थिति ऑपरेटरों के लिए दृश्यमान रखें।"
      },
      "deploy": {
        "title": "तैनात करें",
        "copy": "तैनाती से पहले स्टेशन पथ, रिलीज़ रूट और रनटाइम तैयारी सत्यापित करें।"
      }
    },
    "shell": {
      "language": "हिन्दी",
      "actionStatus": "क्रिया स्थिति",
      "idle": "निष्क्रिय",
      "openWorkbench": "Workbench खोलें",
      "startLocal": "स्थानीय स्टैक शुरू करें",
      "validateEnv": "पर्यावरण सत्यापित करें"
    },
    "bundles": {
      "introTitle": "परियोजना पैकेज",
      "introCopy": "विश्लेषण के लिए परियोजना पैकेज जाँचें, तुलना करें और तैयार करें।",
      "bundlePath": "पैकेज पथ",
      "comparePath": "तुलना पथ",
      "outputPath": "आउटपुट पथ",
      "inspect": "पैकेज निरीक्षण",
      "validate": "पैकेज सत्यापन",
      "normalize": "पैकेज सामान्यीकृत करें",
      "unpack": "पैकेज खोलें",
      "pack": "परियोजना पैक करें",
      "diff": "पैकेजों की तुलना",
      "openWorkbench": "Workbench खोलें",
      "desktopTools": "डेस्कटॉप उपकरण",
      "recentBundles": "हाल के पैकेज",
      "recentCompare": "हाल की तुलनाएँ",
      "recentOutputs": "हाल के आउटपुट",
      "recentActions": "हाल की पैकेज कार्रवाइयाँ",
      "favorites": "पसंदीदा",
      "ready": "पैकेज उपकरण तैयार हैं।",
      "all": "सभी",
      "failed": "विफल",
      "keepFailed": "केवल विफल रखें",
      "import": "JSON आयात करें",
      "export": "JSON निर्यात करें",
      "clear": "इतिहास साफ़ करें",
      "recent": "हाल के",
      "introLabel": "परियोजना पैकेज"
    },
    "home": {
      "tabs": {
        "bundles": "परियोजना पैकेज"
      }
    }
  }
}
