{
  "schema_version": "kyuubiki.language-pack/v1",
  "id": "hub-sw-core-2.0",
  "language": "sw",
  "targetSurface": "hub",
  "name": "Swahili Hub Core",
  "version": "3.7.0",
  "versionLine": "daji 3.x",
  "targetAppVersion": "3.7.0",
  "source": "downloaded",
  "updatedAt": "2026-09-19T00:00:00.000Z",
  "description": "Swahili UI translations for Hub navigation, shell actions, and primary route labels.",
  "overrides": {
    "nav": {
      "projects": "Nyumbani",
      "runtimes": "Muda wa utekelezaji",
      "deploy": "Sambaza",
      "observe": "Angalia",
      "tools": "Zana"
    },
    "sections": {
      "projects": {
        "title": "Nyumbani",
        "copy": "Fungua Workbench, thibitisha mazingira, kisha anzisha stack ya ndani kwa mtiririko ulio wazi."
      },
      "runtimes": {
        "title": "Muda wa utekelezaji",
        "copy": "Anzisha stack ya ndani na uache hali ya tendo ionekane kwa waendeshaji."
      },
      "deploy": {
        "title": "Sambaza",
        "copy": "Kabla ya usambazaji, thibitisha njia za kituo, mizizi ya toleo na utayari wa runtime."
      }
    },
    "shell": {
      "language": "Kiswahili",
      "actionStatus": "Hali ya tendo",
      "idle": "kimya",
      "openWorkbench": "Fungua Workbench",
      "startLocal": "Anzisha stack ya ndani",
      "validateEnv": "Thibitisha mazingira"
    },
    "bundles": {
      "introTitle": "Vifurushi vya mradi",
      "introCopy": "Kagua, linganisha na andaa vifurushi vya mradi kwa uchambuzi.",
      "bundlePath": "Njia ya kifurushi",
      "comparePath": "Njia ya kulinganisha",
      "outputPath": "Njia ya matokeo",
      "inspect": "Kagua kifurushi",
      "validate": "Thibitisha kifurushi",
      "normalize": "Sanifisha kifurushi",
      "unpack": "Fungua kifurushi",
      "pack": "Funga mradi kwenye kifurushi",
      "diff": "Linganisha vifurushi",
      "openWorkbench": "Fungua Workbench",
      "desktopTools": "Zana za eneo-kazi",
      "recentBundles": "Vifurushi vya karibuni",
      "recentCompare": "Ulinganisho wa karibuni",
      "recentOutputs": "Matokeo ya karibuni",
      "recentActions": "Vitendo vya karibuni vya vifurushi",
      "favorites": "Vipendwa",
      "ready": "Zana za vifurushi ziko tayari.",
      "all": "Vyote",
      "failed": "Vilivyoshindwa",
      "keepFailed": "Hifadhi vilivyoshindwa tu",
      "import": "Ingiza JSON",
      "export": "Hamisha JSON",
      "clear": "Futa historia",
      "recent": "Karibuni",
      "introLabel": "Vifurushi vya mradi"
    },
    "home": {
      "tabs": {
        "bundles": "Vifurushi vya mradi"
      }
    }
  }
}
