{
  "schema_version": "kyuubiki.language-pack/v1",
  "id": "workbench-ur-core-2.0",
  "language": "ur",
  "targetSurface": "workbench",
  "name": "Urdu Workbench Core",
  "version": "2.0.0",
  "versionLine": "moxi 2.x",
  "targetAppVersion": "2.0.0",
  "source": "downloaded",
  "updatedAt": "2026-07-16T00:00:00.000Z",
  "description": "Urdu UI translations for Workbench navigation, workflow, store, and system surfaces.",
  "overrides": {
    "title": "Kyuubiki Workbench · اردو",
    "subtitle": "سیمولیشن، ورک فلو اور ایجنٹس کے لیے ورک اسپیس۔",
    "rail": {
      "study": "مطالعہ",
      "model": "ماڈل",
      "workflow": "ورک فلو",
      "store": "اسٹور",
      "library": "تاریخچہ",
      "system": "نظام"
    },
    "sections": {
      "study": "مطالعہ ترتیب",
      "model": "ماڈل اسپیس",
      "workflow": "ورک فلو اسٹوڈیو",
      "store": "پروجیکٹ اسٹور",
      "library": "کاموں کا تاریخچہ",
      "system": "نظام"
    },
    "workflowBuilderPage": "بلڈر",
    "workflowRunsPage": "رنز",
    "workflowCatalogTitle": "ورک فلو کیٹلاگ",
    "workflowTemplateChainLibraryLabel": "چین لائبریری",
    "languagePacksTitle": "نصب شدہ زبان پیک",
    "languagePacksHint": "مقامی JSON پیک ابھی درآمد کریں؛ یہی envelope بعد کی ریموٹ تقسیم کے لیے تیار رہے گا۔",
    "languagePacksEmptyLabel": "ابھی کوئی کسٹم زبان پیک نصب نہیں ہے۔",
    "languagePackName": "نام",
    "languagePackVersion": "ورژن",
    "languagePackSourceImported": "درآمد شدہ",
    "languagePackSourceDownloaded": "ڈاؤن لوڈ شدہ",
    "languagePackDownloadTemplate": "ٹیمپلیٹ ڈاؤن لوڈ کریں",
    "languagePackExportInstalled": "نصب شدہ پیک برآمد کریں",
    "languagePackImport": "پیک درآمد کریں",
    "languagePackRemove": "ہٹائیں",
    "languagePackCatalogTitle": "مستقبل کا کیٹلاگ",
    "languagePackCatalogHint": "مقامی JSON پیک ابھی درآمد کریں؛ یہی envelope بعد کی ریموٹ تقسیم کے لیے تیار رہے گا۔",
    "languagePackCatalogAction": "جلد"
  }
}
