{
  "schema_version": "kyuubiki.language-pack/v1",
  "id": "workbench-id-core-2.0",
  "language": "id",
  "targetSurface": "workbench",
  "name": "Indonesian Workbench Core",
  "version": "2.0.0",
  "versionLine": "moxi 2.x",
  "targetAppVersion": "2.0.0",
  "source": "downloaded",
  "updatedAt": "2026-07-16T00:00:00.000Z",
  "description": "Indonesian UI translations for Workbench navigation, workflow, store, and system surfaces.",
  "overrides": {
    "title": "Kyuubiki Workbench · Bahasa Indonesia",
    "subtitle": "Ruang kerja untuk simulasi, workflow, dan agen.",
    "rail": {
      "study": "Studi",
      "model": "Model",
      "workflow": "Workflow",
      "store": "Store",
      "library": "Riwayat",
      "system": "Sistem"
    },
    "sections": {
      "study": "Pengaturan studi",
      "model": "Ruang model",
      "workflow": "Studio workflow",
      "store": "Store proyek",
      "library": "Riwayat tugas",
      "system": "Sistem"
    },
    "workflowBuilderPage": "Builder",
    "workflowRunsPage": "Run",
    "workflowCatalogTitle": "Katalog workflow",
    "workflowTemplateChainLibraryLabel": "Pustaka rantai",
    "languagePacksTitle": "Paket bahasa terpasang",
    "languagePacksHint": "Impor paket JSON lokal sekarang; envelope yang sama siap untuk distribusi jarak jauh nanti.",
    "languagePacksEmptyLabel": "Belum ada paket bahasa kustom yang terpasang.",
    "languagePackName": "Nama",
    "languagePackVersion": "Versi",
    "languagePackSourceImported": "Diimpor",
    "languagePackSourceDownloaded": "Diunduh",
    "languagePackDownloadTemplate": "Unduh template",
    "languagePackExportInstalled": "Ekspor paket terpasang",
    "languagePackImport": "Impor paket",
    "languagePackRemove": "Hapus",
    "languagePackCatalogTitle": "Katalog masa depan",
    "languagePackCatalogHint": "Impor paket JSON lokal sekarang; envelope yang sama siap untuk distribusi jarak jauh nanti.",
    "languagePackCatalogAction": "Segera"
  }
}
