{
  "schema_version": "kyuubiki.language-pack/v1",
  "id": "hub-ms-core-2.0",
  "language": "ms",
  "targetSurface": "hub",
  "name": "Malay Hub Core",
  "version": "3.4.5",
  "versionLine": "daji 3.x",
  "targetAppVersion": "3.4.5",
  "source": "downloaded",
  "updatedAt": "2026-09-19T00:00:00.000Z",
  "description": "Malay UI translations for Hub navigation, shell actions, and primary route labels.",
  "overrides": {
    "nav": {
      "projects": "Laman utama",
      "runtimes": "Runtime",
      "deploy": "Laksana",
      "observe": "Pantau",
      "tools": "Alat"
    },
    "sections": {
      "projects": {
        "title": "Laman utama",
        "copy": "Buka Workbench, sahkan persekitaran, kemudian mulakan stack tempatan dalam aliran yang jelas."
      },
      "runtimes": {
        "title": "Runtime",
        "copy": "Mulakan stack tempatan dan kekalkan status tindakan kelihatan kepada operator."
      },
      "deploy": {
        "title": "Laksana",
        "copy": "Sebelum pelaksanaan, sahkan laluan stesen, akar keluaran dan kesediaan runtime."
      }
    },
    "shell": {
      "language": "Bahasa Melayu",
      "actionStatus": "Status tindakan",
      "idle": "melahu",
      "openWorkbench": "Buka Workbench",
      "startLocal": "Mulakan stack tempatan",
      "validateEnv": "Sahkan persekitaran"
    },
    "bundles": {
      "introTitle": "Pakej projek",
      "introCopy": "Semak, bandingkan dan sediakan pakej projek untuk analisis.",
      "bundlePath": "Laluan pakej",
      "comparePath": "Laluan perbandingan",
      "outputPath": "Laluan output",
      "inspect": "Periksa pakej",
      "validate": "Sahkan pakej",
      "normalize": "Normalkan pakej",
      "unpack": "Ekstrak pakej",
      "pack": "Bungkus projek",
      "diff": "Bandingkan pakej",
      "openWorkbench": "Buka Workbench",
      "desktopTools": "Alat desktop",
      "recentBundles": "Pakej terkini",
      "recentCompare": "Perbandingan terkini",
      "recentOutputs": "Output terkini",
      "recentActions": "Tindakan pakej terkini",
      "favorites": "Kegemaran",
      "ready": "Alat pakej sedia.",
      "all": "Semua",
      "failed": "Gagal",
      "keepFailed": "Simpan yang gagal sahaja",
      "import": "Import JSON",
      "export": "Eksport JSON",
      "clear": "Kosongkan sejarah",
      "recent": "Terkini",
      "introLabel": "Pakej projek"
    },
    "home": {
      "tabs": {
        "bundles": "Pakej projek"
      }
    }
  }
}
