{
  "schema_version": "kyuubiki.language-pack/v1",
  "id": "hub-id-core-2.0",
  "language": "id",
  "targetSurface": "hub",
  "name": "Indonesian Hub Core",
  "version": "3.7.0",
  "versionLine": "daji 3.x",
  "targetAppVersion": "3.7.0",
  "source": "downloaded",
  "updatedAt": "2026-09-19T00:00:00.000Z",
  "description": "Indonesian UI translations for Hub navigation, shell actions, and primary route labels.",
  "overrides": {
    "nav": {
      "projects": "Beranda",
      "runtimes": "Runtime",
      "deploy": "Deploy",
      "observe": "Pantau",
      "tools": "Alat"
    },
    "sections": {
      "projects": {
        "title": "Beranda",
        "copy": "Buka Workbench, validasi lingkungan, lalu mulai stack lokal dalam alur yang jelas."
      },
      "runtimes": {
        "title": "Runtime",
        "copy": "Mulai stack lokal dan biarkan status aksi terlihat oleh operator."
      },
      "deploy": {
        "title": "Deploy",
        "copy": "Sebelum deploy, validasi path stasiun, akar rilis, dan kesiapan runtime."
      }
    },
    "shell": {
      "language": "Bahasa Indonesia",
      "actionStatus": "Status aksi",
      "idle": "diam",
      "openWorkbench": "Buka Workbench",
      "startLocal": "Mulai stack lokal",
      "validateEnv": "Validasi lingkungan"
    },
    "bundles": {
      "introTitle": "Paket proyek",
      "introCopy": "Periksa, bandingkan, dan siapkan paket proyek untuk analisis.",
      "bundlePath": "Jalur paket",
      "comparePath": "Jalur pembanding",
      "outputPath": "Jalur keluaran",
      "inspect": "Inspeksi paket",
      "validate": "Validasi paket",
      "normalize": "Normalkan paket",
      "unpack": "Ekstrak paket",
      "pack": "Kemas proyek",
      "diff": "Bandingkan paket",
      "openWorkbench": "Buka Workbench",
      "desktopTools": "Alat desktop",
      "recentBundles": "Paket terbaru",
      "recentCompare": "Perbandingan terbaru",
      "recentOutputs": "Keluaran terbaru",
      "recentActions": "Tindakan paket terbaru",
      "favorites": "Favorit",
      "ready": "Alat paket siap.",
      "all": "Semua",
      "failed": "Gagal",
      "keepFailed": "Simpan yang gagal saja",
      "import": "Impor JSON",
      "export": "Ekspor JSON",
      "clear": "Hapus riwayat",
      "recent": "Terbaru",
      "introLabel": "Paket proyek"
    },
    "home": {
      "tabs": {
        "bundles": "Paket proyek"
      }
    }
  }
}
