{
  "schema_version": "kyuubiki.language-pack/v1",
  "id": "workbench-sw-core-2.0",
  "language": "sw",
  "targetSurface": "workbench",
  "name": "Swahili Workbench Core",
  "version": "2.2.8",
  "versionLine": "moxi 2.x",
  "targetAppVersion": "2.2.8",
  "source": "downloaded",
  "updatedAt": "2026-07-16T00:00:00.000Z",
  "description": "Swahili UI translations for Workbench navigation, workflow, store, and system surfaces.",
  "overrides": {
    "title": "Kyuubiki Workbench · Kiswahili",
    "subtitle": "Nafasi ya kazi kwa uigaji, mitiririko na mawakala.",
    "rail": {
      "study": "Utafiti",
      "model": "Mfano",
      "workflow": "Mtiririko",
      "store": "Duka",
      "library": "Historia",
      "system": "Mfumo"
    },
    "sections": {
      "study": "Mpangilio wa utafiti",
      "model": "Nafasi ya mfano",
      "workflow": "Studio ya mtiririko",
      "store": "Duka la mradi",
      "library": "Historia ya kazi",
      "system": "Mfumo"
    },
    "workflowBuilderPage": "Mjenzi",
    "workflowRunsPage": "Utekelezaji",
    "workflowCatalogTitle": "Katalogi ya mitiririko",
    "workflowTemplateChainLibraryLabel": "Maktaba ya minyororo",
    "languagePacksTitle": "Pakiti za lugha zilizosakinishwa",
    "languagePacksHint": "Ingiza pakiti za JSON za ndani sasa; envelope ile ile itabaki tayari kwa usambazaji wa mbali baadaye.",
    "languagePacksEmptyLabel": "Hakuna pakiti ya lugha maalum iliyosakinishwa bado.",
    "languagePackName": "Jina",
    "languagePackVersion": "Toleo",
    "languagePackSourceImported": "Imeingizwa",
    "languagePackSourceDownloaded": "Imepakuliwa",
    "languagePackDownloadTemplate": "Pakua kiolezo",
    "languagePackExportInstalled": "Hamisha pakiti iliyosakinishwa",
    "languagePackImport": "Ingiza pakiti",
    "languagePackRemove": "Ondoa",
    "languagePackCatalogTitle": "Katalogi ya baadaye",
    "languagePackCatalogHint": "Ingiza pakiti za JSON za ndani sasa; envelope ile ile itabaki tayari kwa usambazaji wa mbali baadaye.",
    "languagePackCatalogAction": "Hivi karibuni"
  }
}
