{
  "schema_version": "kyuubiki.language-pack/v1",
  "id": "hub-tr-core-2.0",
  "language": "tr",
  "targetSurface": "hub",
  "name": "Turkish Hub Core",
  "version": "3.6.0",
  "versionLine": "daji 3.x",
  "targetAppVersion": "3.6.0",
  "source": "downloaded",
  "updatedAt": "2026-09-19T00:00:00.000Z",
  "description": "Turkish UI translations for Hub navigation, shell actions, and primary route labels.",
  "overrides": {
    "nav": {
      "projects": "Ana sayfa",
      "runtimes": "Çalışma zamanları",
      "deploy": "Dağıt",
      "observe": "Gözlemle",
      "tools": "Araçlar"
    },
    "sections": {
      "projects": {
        "title": "Ana sayfa",
        "copy": "Workbench açın, ortamı doğrulayın ve yerel stacki net bir akışla başlatın."
      },
      "runtimes": {
        "title": "Çalışma zamanları",
        "copy": "Yerel stacki başlatın ve eylem durumunu operatörler için görünür tutun."
      },
      "deploy": {
        "title": "Dağıt",
        "copy": "Dağıtımdan önce istasyon yollarını, yayın köklerini ve runtime hazır oluşunu doğrulayın."
      }
    },
    "shell": {
      "language": "Türkçe",
      "actionStatus": "Eylem durumu",
      "idle": "boşta",
      "openWorkbench": "Workbench aç",
      "startLocal": "Yerel stack başlat",
      "validateEnv": "Ortamı doğrula"
    },
    "bundles": {
      "introTitle": "Proje paketleri",
      "introCopy": "Proje paketlerini denetleyin, karşılaştırın ve analize hazırlayın.",
      "bundlePath": "Paket yolu",
      "comparePath": "Karşılaştırma yolu",
      "outputPath": "Çıktı yolu",
      "inspect": "Paketi incele",
      "validate": "Paketi doğrula",
      "normalize": "Paketi normalleştir",
      "unpack": "Paketi aç",
      "pack": "Projeyi paketle",
      "diff": "Paketleri karşılaştır",
      "openWorkbench": "Workbench'i aç",
      "desktopTools": "Masaüstü araçları",
      "recentBundles": "Son paketler",
      "recentCompare": "Son karşılaştırmalar",
      "recentOutputs": "Son çıktılar",
      "recentActions": "Son paket işlemleri",
      "favorites": "Favoriler",
      "ready": "Paket araçları hazır.",
      "all": "Tümü",
      "failed": "Başarısız",
      "keepFailed": "Yalnızca başarısızları tut",
      "import": "JSON içe aktar",
      "export": "JSON dışa aktar",
      "clear": "Geçmişi temizle",
      "recent": "Son kullanılanlar",
      "introLabel": "Proje paketleri"
    },
    "home": {
      "tabs": {
        "bundles": "Proje paketleri"
      }
    }
  }
}
