{
  "schema_version": "kyuubiki.language-pack/v1",
  "id": "workbench-cs-core-2.0",
  "language": "cs",
  "targetSurface": "workbench",
  "name": "Czech Workbench Core",
  "version": "2.0.0",
  "versionLine": "moxi 2.x",
  "targetAppVersion": "2.0.0",
  "source": "downloaded",
  "updatedAt": "2026-07-16T00:00:00.000Z",
  "description": "Czech UI translations for Workbench navigation, workflow, store, and system surfaces.",
  "overrides": {
    "title": "Kyuubiki Workbench · Čeština",
    "subtitle": "Pracovní prostor pro simulace, workflow a agenty.",
    "rail": {
      "study": "Studie",
      "model": "Model",
      "workflow": "Workflow",
      "store": "Obchod",
      "library": "Historie",
      "system": "Systém"
    },
    "sections": {
      "study": "Nastavení studie",
      "model": "Prostor modelu",
      "workflow": "Workflow studio",
      "store": "Projektový obchod",
      "library": "Historie úloh",
      "system": "Systém"
    },
    "workflowBuilderPage": "Builder",
    "workflowRunsPage": "Běhy",
    "workflowCatalogTitle": "Katalog workflow",
    "workflowTemplateChainLibraryLabel": "Knihovna řetězců",
    "languagePacksTitle": "Nainstalované jazykové balíčky",
    "languagePacksHint": "Importujte lokální JSON balíčky nyní; stejný obal zůstane připraven pro vzdálenou distribuci.",
    "languagePacksEmptyLabel": "Zatím není nainstalován žádný vlastní jazykový balíček.",
    "languagePackName": "Název",
    "languagePackVersion": "Verze",
    "languagePackSourceImported": "Importováno",
    "languagePackSourceDownloaded": "Staženo",
    "languagePackDownloadTemplate": "Stáhnout šablonu",
    "languagePackExportInstalled": "Exportovat nainstalovaný balíček",
    "languagePackImport": "Importovat balíček",
    "languagePackRemove": "Odebrat",
    "languagePackCatalogTitle": "Budoucí katalog",
    "languagePackCatalogHint": "Importujte lokální JSON balíčky nyní; stejný obal zůstane připraven pro vzdálenou distribuci.",
    "languagePackCatalogAction": "Brzy"
  }
}
