{
  "schema_version": "kyuubiki.language-pack/v1",
  "id": "hub-no-core-2.0",
  "language": "no",
  "targetSurface": "hub",
  "name": "Norwegian Hub Core",
  "version": "3.7.0",
  "versionLine": "daji 3.x",
  "targetAppVersion": "3.7.0",
  "source": "downloaded",
  "updatedAt": "2026-09-19T00:00:00.000Z",
  "description": "Norwegian UI translations for Hub navigation, shell actions, and primary route labels.",
  "overrides": {
    "nav": {
      "projects": "Hjem",
      "runtimes": "Kjøretider",
      "deploy": "Distribuer",
      "observe": "Overvåk",
      "tools": "Verktøy"
    },
    "sections": {
      "projects": {
        "title": "Hjem",
        "copy": "Åpne Workbench, valider miljøet og start den lokale stacken i en tydelig flyt."
      },
      "runtimes": {
        "title": "Kjøretider",
        "copy": "Start den lokale stacken og hold handlingsstatus synlig for operatører."
      },
      "deploy": {
        "title": "Distribuer",
        "copy": "Valider stasjonsstier, utgivelsesrøtter og runtime-beredskap før distribusjon."
      }
    },
    "shell": {
      "language": "Norsk",
      "actionStatus": "Handlingsstatus",
      "idle": "inaktiv",
      "openWorkbench": "Åpne Workbench",
      "startLocal": "Start lokal stack",
      "validateEnv": "Valider miljø"
    },
    "bundles": {
      "introTitle": "Prosjektpakker",
      "introCopy": "Kontroller, sammenlign og klargjør prosjektpakker for analyse.",
      "bundlePath": "Pakkebane",
      "comparePath": "Sammenligningsbane",
      "outputPath": "Utdatabane",
      "inspect": "Undersøk pakke",
      "validate": "Valider pakke",
      "normalize": "Normaliser pakke",
      "unpack": "Pakk ut pakke",
      "pack": "Pakk prosjekt",
      "diff": "Sammenlign pakker",
      "openWorkbench": "Åpne Workbench",
      "desktopTools": "Skrivebordsverktøy",
      "recentBundles": "Nylige pakker",
      "recentCompare": "Nylige sammenligninger",
      "recentOutputs": "Nylige utdata",
      "recentActions": "Nylige pakkehandlinger",
      "favorites": "Favoritter",
      "ready": "Pakkeverktøyene er klare.",
      "all": "Alle",
      "failed": "Mislykkede",
      "keepFailed": "Behold bare mislykkede",
      "import": "Importer JSON",
      "export": "Eksporter JSON",
      "clear": "Tøm historikk",
      "recent": "Nylige",
      "introLabel": "Prosjektpakker"
    },
    "home": {
      "tabs": {
        "bundles": "Prosjektpakker"
      }
    }
  }
}
