{
  "schema_version": "kyuubiki.language-pack/v1",
  "id": "hub-fi-core-2.0",
  "language": "fi",
  "targetSurface": "hub",
  "name": "Finnish Hub Core",
  "version": "3.4.7",
  "versionLine": "daji 3.x",
  "targetAppVersion": "3.4.7",
  "source": "downloaded",
  "updatedAt": "2026-09-19T00:00:00.000Z",
  "description": "Finnish UI translations for Hub navigation, shell actions, and primary route labels.",
  "overrides": {
    "nav": {
      "projects": "Koti",
      "runtimes": "Ajonaikaiset",
      "deploy": "Julkaise",
      "observe": "Tarkkaile",
      "tools": "Työkalut"
    },
    "sections": {
      "projects": {
        "title": "Koti",
        "copy": "Avaa Workbench, vahvista ympäristö ja käynnistä paikallinen pino selkeässä työnkulussa."
      },
      "runtimes": {
        "title": "Ajonaikaiset",
        "copy": "Käynnistä paikallinen pino ja pidä toiminnon tila operaattorien nähtävillä."
      },
      "deploy": {
        "title": "Julkaise",
        "copy": "Vahvista asemapolut, julkaisun juuret ja ajonaikainen valmius ennen julkaisua."
      }
    },
    "shell": {
      "language": "Suomi",
      "actionStatus": "Toiminnon tila",
      "idle": "jouten",
      "openWorkbench": "Avaa Workbench",
      "startLocal": "Käynnistä paikallinen pino",
      "validateEnv": "Vahvista ympäristö"
    },
    "bundles": {
      "introTitle": "Projektipaketit",
      "introCopy": "Tarkista, vertaile ja valmistele projektipaketit analyysia varten.",
      "bundlePath": "Paketin polku",
      "comparePath": "Vertailupolku",
      "outputPath": "Tulospolku",
      "inspect": "Tarkastele pakettia",
      "validate": "Tarkista paketti",
      "normalize": "Normalisoi paketti",
      "unpack": "Pura paketti",
      "pack": "Paketoi projekti",
      "diff": "Vertaa paketteja",
      "openWorkbench": "Avaa Workbench",
      "desktopTools": "Työpöytätyökalut",
      "recentBundles": "Viimeisimmät paketit",
      "recentCompare": "Viimeisimmät vertailut",
      "recentOutputs": "Viimeisimmät tulosteet",
      "recentActions": "Viimeisimmät pakettitoiminnot",
      "favorites": "Suosikit",
      "ready": "Pakettityökalut ovat valmiina.",
      "all": "Kaikki",
      "failed": "Epäonnistuneet",
      "keepFailed": "Säilytä vain epäonnistuneet",
      "import": "Tuo JSON",
      "export": "Vie JSON",
      "clear": "Tyhjennä historia",
      "recent": "Viimeisimmät",
      "introLabel": "Projektipaketit"
    },
    "home": {
      "tabs": {
        "bundles": "Projektipaketit"
      }
    }
  }
}
